<?xml version="1.0" encoding="UTF-8"?>
<!--
    Licensed to the Apache Software Foundation (ASF) under one
    or more contributor license agreements.  See the NOTICE file
    distributed with this work for additional information
    regarding copyright ownership.  The ASF licenses this file
    to you under the Apache License, Version 2.0 (the
    "License"); you may not use this file except in compliance
    with the License.  You may obtain a copy of the License at

    http://www.apache.org/licenses/LICENSE-2.0

    Unless required by applicable law or agreed to in writing,
    software distributed under the License is distributed on an
    "AS IS" BASIS, WITHOUT WARRANTIES OR CONDITIONS OF ANY
    KIND, either express or implied.  See the License for the
    specific language governing permissions and limitations
    under the License.     
-->
<pluto-portal-driver xmlns="http://portals.apache.org/pluto/xsd/pluto-portal-driver-config.xsd" xmlns:pa="http://java.sun.com/xml/ns/portlet/portlet-app_2_0.xsd" xmlns:xsi="http://www.w3.org/2001/XMLSchema-instance" xsi:schemaLocation="http://portals.apache.org/pluto/xsd/pluto-portal-driver-config.xsd                         http://portals.apache.org/pluto/pluto-portal/1.1/pluto-portal-driver-config.xsd" version="1.1">
<portal-name>pluto-portal-driver</portal-name>
<portal-version>${project.version}</portal-version>
<container-name>Pluto Portal Driver</container-name>
<supports>
<portlet-mode>view</portlet-mode>
<portlet-mode>edit</portlet-mode>
<portlet-mode>help</portlet-mode>
<portlet-mode>config</portlet-mode>
<window-state>normal</window-state>
<window-state>maximized</window-state>
<window-state>minimized</window-state>
</supports>
<render-config default="About Apache Pluto">
<page xmlns="" name="V3PortletParametersTests" uri="/WEB-INF/themes/pluto-default-theme.jsp">
    <portlet context="/${project.artifactId}-${project.version}" name="PortletParametersTests_SPEC11_1"/>
</page>
<page xmlns="" name="V3ActionParametersTests" uri="/WEB-INF/themes/pluto-default-theme.jsp">
    <portlet context="/${project.artifactId}-${project.version}" name="PortletParametersTests_SPEC11_3"/>
</page>
<page xmlns="" name="V3ResourceParametersTests" uri="/WEB-INF/themes/pluto-default-theme.jsp">
    <portlet context="/${project.artifactId}-${project.version}" name="PortletParametersTests_SPEC11_4"/>
</page>
<page xmlns="" name="V3ResourceParametersAddlTests" uri="/WEB-INF/themes/pluto-default-theme.jsp">
    <portlet context="/${project.artifactId}-${project.version}" name="PortletParametersTests_SPEC11_4A"/>
</page>
</render-config>
</pluto-portal-driver>
